{
  "group_id": "d44d5b87-37ce-5db5-9e33-43f477b42f1e",
  "title": "Tuesday Night Group",
  "description": "Study, conversation and dinner together.",
  "meeting": "Tuesdays · 7:00 PM",
  "location": "Lee home, North Park",
  "leaders_line": "Leaders: Leader",
  "members_title": "Members",
  "members": [
    {
      "user_id": "a3201a9f-a3a3-5e46-94bb-48b6807b1b1f",
      "title": "Leader",
      "is_leader": true
    },
    {
      "user_id": "018919a6-047d-52b8-b6e3-363a7e80888c",
      "title": "Member One",
      "is_leader": false
    },
    {
      "user_id": "175eb30f-796d-56d2-84d4-4082b6512629",
      "title": "Member Two",
      "note": "You",
      "is_leader": false
    }
  ]
}
